{"scenario_id":"RC:SCENARIO:S006","authorized":true,"accepted":false,"state_changed":false,"expected_state_version":1,"expected_error_code":"PLANNING_CONSTRAINT_CONFLICT","expected_audit_event":"VERIFY","expected_hash_match":true,"expected_spatial_conflicts":[{"conflict_type":"farmland_control_conflict","target_id":"RC:PARCEL:000010","constraint_id":"RC:BOUNDARY:FARM001","severity":"ERROR"}],"notes":{"zh-Hans":"冲突调整不得进入有效状态。","en":"The conflicting control change must not become effective.","ja":"競合する制御変更は有効化してはならない。"}}