{"scenario_id":"RC:SCENARIO:S001","authorized":true,"accepted":true,"state_changed":true,"expected_state_version":1,"expected_error_code":null,"expected_audit_event":"CREATE","expected_hash_match":true,"expected_spatial_conflicts":[],"notes":{"zh-Hans":"新对象以版本 1 登记。","en":"The new object is registered at version 1.","ja":"新規オブジェクトはバージョン1で登録される。"}}