{"scenario_id":"RC:SCENARIO:S005","authorized":true,"accepted":false,"state_changed":false,"expected_state_version":1,"expected_error_code":"HASH_MISMATCH","expected_audit_event":"VERIFY","expected_hash_match":false,"expected_spatial_conflicts":[],"notes":{"zh-Hans":"文档 canonical Hash 与批准时记录值不一致。","en":"The canonical document hash no longer matches the approved record.","ja":"文書の canonical Hash が承認時記録と一致しない。"}}