{"scenario_id":"RC:SCENARIO:S010","authorized":true,"accepted":false,"state_changed":false,"expected_state_version":2,"expected_error_code":"VERSION_CONFLICT","expected_audit_event":"VERIFY","expected_hash_match":true,"expected_spatial_conflicts":[],"notes":{"zh-Hans":"旧版本前置条件必须拒绝，服务端状态保持版本 2。","en":"The stale precondition is rejected and authoritative state remains version 2.","ja":"古い前提条件は拒否され正本状態はバージョン2のままとなる。"}}