{"scenario_id":"RC:SCENARIO:S007","authorized":true,"accepted":false,"state_changed":false,"expected_state_version":1,"expected_error_code":"SPATIAL_CONFLICT","expected_audit_event":"VERIFY","expected_hash_match":true,"expected_spatial_conflicts":[{"conflict_type":"ecological_boundary_conflict","target_id":"RC:PARCEL:000001","constraint_id":"RC:BOUNDARY:ECO001","severity":"ERROR"}],"notes":{"zh-Hans":"项目申请可被提交主体发起，但因空间冲突被拒绝。","en":"The applicant is authorized to submit, but the project is rejected for spatial conflict.","ja":"申請権限はあるが空間競合により拒否される。"}}