{"scenario_id":"RC:SCENARIO:S008","authorized":true,"accepted":false,"state_changed":false,"expected_state_version":1,"expected_error_code":"MISSING_SIGNATURE","expected_audit_event":"VERIFY","expected_hash_match":true,"expected_spatial_conflicts":[],"notes":{"zh-Hans":"仅有文档不足以生效，必须具有要求的签名证明。","en":"The document alone is insufficient; the required signature proof must exist.","ja":"文書だけでは発効できず必要な署名証明が必要である。"}}