{"scenario_id":"RC:SCENARIO:S004","authorized":false,"accepted":false,"state_changed":false,"expected_state_version":1,"expected_error_code":"UNAUTHORIZED","expected_audit_event":"ATTEMPT_UNAUTHORIZED_CHANGE","expected_hash_match":true,"expected_spatial_conflicts":[],"notes":{"zh-Hans":"越权请求必须拒绝并留审计记录。","en":"The unauthorized request must be rejected and audited.","ja":"権限外リクエストは拒否され監査記録を残す。"}}